{"judgeRunId":"sack-final-r2-reader-20260715","evalId":"warren-sack-lens","role":"hiring-reader-judge","candidateSha256":"c9bdee47272f1f90089b2568a89a224c173fcce97eca299aad6898037eb549c4","allHardGatesPassed":true,"hardGateFindings":[{"id":"evidence-and-attribution","passed":true,"finding":"The candidate stays within the recorded scope: public-safe records support Jamie tending the ten-day Open House and Time is Long as realized, while bounded protected summaries support the interface prototype and co-designed room-based photograph-browsing proposal. The first-person statement that the same inquiry continues clearly presents cross-period continuity as Jamie's interpretation."},{"id":"no-network-determinism","passed":true,"finding":"The candidate identifies recursive social-network analysis as one representation joined with image comparison, without claiming that computed networks exhaust human relationships. Its closing emphasis on people, materials, relationships, and place preserves the distinction between analytical structures and lived relations."},{"id":"prototype-status-and-collective-credit","passed":true,"finding":"The maturity repair is explicit and accurate: Time is Long is a realized installation, the analysis-and-image interface is something Jamie prototyped, and the physical-room browsing concept is a co-designed documented proposal. The wording neither upgrades either course artifact into deployment nor assigns Jamie sole credit for the collaborative proposal."},{"id":"public-legibility-and-safety","passed":true,"finding":"A hiring reader can readily distinguish the communal event, physical installation, interface prototype, and spatial proposal. The candidate exposes no protected record, identifier, correspondence, contact detail, private locator, or unapproved image."}],"dimensionFindings":[{"id":"recursive-relational-reasoning","passed":true,"finding":"Recursive social-network analysis supplies an explicit relational method, while the conclusion makes the operating principle legible: form grows from people, materials, relationships, and place rather than from isolated objects or abstract systems language."},{"id":"cross-representational-translation","passed":true,"finding":"The passage makes several translations concrete: elapsed time becomes physical in Time is Long; recursive network analysis meets image comparison through an interface; and online photographs become navigable through movement across physical rooms."},{"id":"prototype-and-artifact-specificity","passed":true,"finding":"The revised wording successfully separates three maturity states—realized installation, interface prototype, and co-designed documented proposal—while treating the later civic, technical, and organizational connection as continuing practice rather than another completed artifact."},{"id":"source-rigor","passed":true,"finding":"Each specimen remains within the repository's public-safe claim layer, with protected educational summaries used only for bounded support. The candidate invents no deployment, measured reception, causality, ownership, or claim that every later project derives from the early work."},{"id":"collective-agency-and-feedback","passed":true,"finding":"Agency remains distributed through the communal Open House Jamie tended, the explicitly co-designed proposal, the emphasis on participation, and the statement that form grows from people and relationships already present. Jamie's role is visible without making him sole author of collective activity."}],"score":5,"regressions":[],"requiredRevisions":[],"limitations":["The review is confined to public-safe repository records."]}